[
  {"id":"test:park","name":"QA TEST парк","name_en":"QA TEST park","name_kk":"QA TEST саябақ","lat":51.129,"lon":71.43,"category":"park","tags":["walk"],"description":"Тестовая зелёная зона для прогулки.","description_source":"website","address":null,"opening_hours":null,"phone":null,"website":null,"rating":null,"rating_count":null,"wheelchair":"yes","kid_friendly":true,"source":"test_fixture","source_url":"https://example.com/qa/park","updated_at":"2026-10-18"},
  {"id":"test:cafe","name":"QA TEST кафе","name_en":"QA TEST cafe","name_kk":"QA TEST кафе","lat":51.128,"lon":71.431,"category":"cafe","tags":["quiet","socket"],"description":"Тестовое кафе: в фикстуре явно указаны тихий зал и розетки.","description_source":"website","address":null,"opening_hours":"24/7","phone":null,"website":null,"rating":4.5,"rating_count":10,"wheelchair":"limited","kid_friendly":null,"source":"test_fixture","source_url":"https://example.com/qa/cafe","updated_at":"2026-10-18"},
  {"id":"test:museum","name":"QA TEST музей","name_en":"QA TEST museum","name_kk":"QA TEST мұражай","lat":51.13,"lon":71.43,"category":"museum","tags":["interactive"],"description":"Тестовый музей с интерактивной экспозицией.","description_source":"website","address":null,"opening_hours":"Mo-Su 10:00-18:00","phone":null,"website":null,"rating":null,"rating_count":null,"wheelchair":"no","kid_friendly":true,"source":"test_fixture","source_url":"https://example.com/qa/museum","updated_at":"2026-10-18"},
  {"id":"test:playground","name":"QA TEST площадка","name_en":"QA TEST playground","name_kk":"QA TEST ойын алаңы","lat":51.128,"lon":71.429,"category":"playground","tags":["kids"],"description":"Тестовая детская площадка.","description_source":"website","address":null,"opening_hours":null,"phone":null,"website":null,"rating":null,"rating_count":null,"wheelchair":null,"kid_friendly":true,"source":"test_fixture","source_url":"https://example.com/qa/playground","updated_at":"2026-10-18"},
  {"id":"test:night","name":"QA TEST ночное место","name_en":"QA TEST night venue","name_kk":"QA TEST түнгі орын","lat":51.127,"lon":71.43,"category":"nightlife","tags":["night"],"description":"Тестовое место с переходящим через полночь расписанием.","description_source":"website","address":null,"opening_hours":"Mo-Su 20:00-02:00","phone":null,"website":null,"rating":null,"rating_count":null,"wheelchair":null,"kid_friendly":false,"source":"test_fixture","source_url":"https://example.com/qa/night","updated_at":"2026-10-18"},
  {"id":"test:far","name":"QA TEST дальнее место","name_en":"QA TEST distant park","name_kk":"QA TEST алыс саябақ","lat":51.2,"lon":71.5,"category":"park","tags":["walk"],"description":"Тестовый объект за пределами малого радиуса.","description_source":"llm_generated","address":null,"opening_hours":null,"phone":null,"website":null,"rating":null,"rating_count":null,"wheelchair":null,"kid_friendly":null,"source":"test_fixture","source_url":"https://example.com/qa/far","updated_at":"2026-10-18"}
]
